import type { ProcessedEvent } from '../types/Analytics';

export const CONSOLIDATED_EVENTS: ProcessedEvent[] = [
  {
    "id": "evt-auto-1",
    "name": "Brassa (09/01/2026)",
    "date": "2026-01-09",
    "totalRevenue": 30412,
    "totalAudience": 766,
    "cortesias": 382,
    "coupons": {
      "PPLURAL": 53,
      "GIRLS": 37,
      "PARKERS": 35,
      "BRAGA": 11,
      "GODOY": 9,
      "LAGOA": 5,
      "RVC": 4,
      "BOLA": 2,
      "ANABIA": 2,
      "FESTASZS": 2,
      "AGONIA": 2,
      "AGNOVA": 1,
      "VAMOS": 1,
      "VODKA": 1
    },
    "totalCoupons": 165,
    "totalPayingQty": 384,
    "percentPaying": 50.13054830287206,
    "avgTicket": 79.19791666666667,
    "doorRevenue": 0,
    "doorQty": 0,
    "doorTM": 0,
    "dailySales": [],
    "preSaleRevenue": 30412,
    "preSaleQty": 766,
    "avgAge": 22.8,
    "salesChannels": {
      "pos": 526,
      "site": 182,
      "app": 58
    }
  },
  {
    "id": "evt-auto-2",
    "name": "DiMarola (19/12/2025)",
    "date": "2025-12-19",
    "totalRevenue": 67417,
    "totalAudience": 1185,
    "cortesias": 436,
    "coupons": {
      "PARKERS": 73,
      "AGNOVA": 64,
      "VAMOS": 23,
      "YASFRANCO": 22,
      "CONECTA": 22,
      "FESTASZS": 14,
      "GODOY": 10,
      "ANABIA": 9,
      "BRAGA": 8,
      "GIRLS": 7,
      "RVC": 6,
      "VODKA": 6,
      "RIO": 4,
      "BOLA": 4,
      "FLAGE": 4,
      "AGNOVANIT": 3,
      "AGONIA": 3,
      "BALADA": 2,
      "RIO40": 2,
      "LAGOA": 1,
      "MELLO": 1,
      "SALIM": 1
    },
    "totalCoupons": 289,
    "totalPayingQty": 749,
    "percentPaying": 63.20675105485232,
    "avgTicket": 90.00934579439253,
    "doorRevenue": 0,
    "doorQty": 0,
    "doorTM": 0,
    "dailySales": [],
    "preSaleRevenue": 67417,
    "preSaleQty": 1185,
    "avgAge": 21.8,
    "salesChannels": {
      "pos": 816,
      "site": 278,
      "app": 91
    }
  },
  {
    "id": "evt-auto-3",
    "name": "Erro 404 (23/01/2026)",
    "date": "2026-01-23",
    "totalRevenue": 37112,
    "totalAudience": 822,
    "cortesias": 374,
    "coupons": {
      "NOITE": 1,
      "STEPHANIEROCHA": 5,
      "RVC": 16,
      "BOLA": 13,
      "FLAGE": 5,
      "MGM": 30,
      "PARKERS": 43,
      "JOA": 22,
      "BRAGA": 5,
      "GIRLS": 21,
      "SALIM": 6,
      "ANABIA": 3,
      "FESTASZS": 1,
      "CONECTA": 13,
      "GODOY": 8,
      "AGONIA": 4,
      "AGUIA": 2,
      "VAMOS": 2
    },
    "totalCoupons": 200,
    "totalPayingQty": 448,
    "percentPaying": 54.50121654501216,
    "avgTicket": 82.83928571428571,
    "doorRevenue": 0,
    "doorQty": 0,
    "doorTM": 0,
    "dailySales": [],
    "preSaleRevenue": 37112,
    "preSaleQty": 822,
    "avgAge": 20.7,
    "salesChannels": {
      "pos": 586,
      "site": 158,
      "app": 78
    }
  },
  {
    "id": "evt-auto-4",
    "name": "Pista (14/11/2025)",
    "date": "2025-11-14",
    "totalRevenue": 32042,
    "totalAudience": 837,
    "cortesias": 398,
    "coupons": {
      "LAGOA": 3,
      "PARKERS": 81,
      "AGONIA": 31,
      "GODOY": 45,
      "BRAGA": 14,
      "CONECTA": 2,
      "PARTIU": 2,
      "AGNOVA": 32,
      "BIKINI": 14,
      "ANABIA": 7,
      "GIRLS": 9,
      "FLAGE": 4,
      "VODKA": 1
    },
    "totalCoupons": 245,
    "totalPayingQty": 439,
    "percentPaying": 52.44922341696535,
    "avgTicket": 72.9886104783599,
    "doorRevenue": 0,
    "doorQty": 0,
    "doorTM": 0,
    "dailySales": [],
    "preSaleRevenue": 32042,
    "preSaleQty": 837,
    "avgAge": 21.9,
    "salesChannels": {
      "pos": 564,
      "site": 245,
      "app": 28
    }
  },
  {
    "id": "evt-auto-5",
    "name": "Pista (21/11/2025)",
    "date": "2025-11-21",
    "totalRevenue": 63652,
    "totalAudience": 1065,
    "cortesias": 353,
    "coupons": {
      "PARKERS": 193,
      "BRAGA": 11,
      "MGM": 10,
      "AGUIA": 11,
      "GIRLS": 18,
      "RVC": 13,
      "GODOY": 9,
      "ANABIA": 16,
      "BOLA": 2,
      "ERROR": 6,
      "SALIM": 2,
      "FESTASZS": 19,
      "BALADA": 2,
      "FLAGE": 3,
      "MARROM": 3,
      "CONECTA": 2,
      "VODKA": 1,
      "AGNOVA": 3,
      "BR": 1
    },
    "totalCoupons": 325,
    "totalPayingQty": 712,
    "percentPaying": 66.85446009389672,
    "avgTicket": 89.39887640449439,
    "doorRevenue": 0,
    "doorQty": 0,
    "doorTM": 0,
    "dailySales": [],
    "preSaleRevenue": 63652,
    "preSaleQty": 1065,
    "avgAge": 22.2,
    "salesChannels": {
      "pos": 632,
      "site": 344,
      "app": 89
    }
  },
  {
    "id": "evt-auto-6",
    "name": "Primeira Sexta (02/01/2026)",
    "date": "2026-01-02",
    "totalRevenue": 61202,
    "totalAudience": 978,
    "cortesias": 321,
    "coupons": {
      "GODOY": 6,
      "PARKERS": 92,
      "YASFRANCO": 3,
      "FESTASZS": 27,
      "AGNOVA": 2,
      "ANABIA": 3,
      "GIRLS": 31,
      "BALADA": 1,
      "CONECTA": 2,
      "SALIM": 7,
      "BOLA": 4,
      "FLAGE": 3,
      "AGONIA": 8,
      "BRAGA": 16
    },
    "totalCoupons": 205,
    "totalPayingQty": 657,
    "percentPaying": 67.17791411042946,
    "avgTicket": 93.15372907153728,
    "doorRevenue": 0,
    "doorQty": 0,
    "doorTM": 0,
    "dailySales": [],
    "preSaleRevenue": 61202,
    "preSaleQty": 978,
    "avgAge": 22.9,
    "salesChannels": {
      "pos": 633,
      "site": 276,
      "app": 69
    }
  },
  {
    "id": "evt-auto-7",
    "name": "Ruby (12/12/2025)",
    "date": "2025-12-12",
    "totalRevenue": 32567,
    "totalAudience": 733,
    "cortesias": 323,
    "coupons": {
      "PARKERS": 74,
      "AGNOVA": 28,
      "GIRLS": 20,
      "SALIM": 24,
      "HELENA": 12,
      "FLAGE": 2,
      "BOLA": 1,
      "GODOY": 26,
      "LAGOA": 1,
      "CONECTA": 3,
      "BRAGA": 5,
      "CEBOLA": 4,
      "FESTASZS": 1,
      "LC": 2,
      "ANABIA": 2,
      "AGONIA": 2
    },
    "totalCoupons": 207,
    "totalPayingQty": 410,
    "percentPaying": 55.934515688949524,
    "avgTicket": 79.43170731707318,
    "doorRevenue": 0,
    "doorQty": 0,
    "doorTM": 0,
    "dailySales": [],
    "preSaleRevenue": 32567,
    "preSaleQty": 733,
    "avgAge": 21.6,
    "salesChannels": {
      "pos": 491,
      "site": 197,
      "app": 45
    }
  },
  {
    "id": "evt-auto-8",
    "name": "Saidera (05/12/2025)",
    "date": "2025-12-05",
    "totalRevenue": 56778,
    "totalAudience": 1036,
    "cortesias": 372,
    "coupons": {
      "SOPRAAMIGOS": 21,
      "SAIDERA": 5,
      "AGNOVA": 66,
      "FESTASZS": 18,
      "PARKERS": 98,
      "GODOY": 18,
      "AGONIA": 34,
      "GIRLS": 19,
      "BRAGA": 6,
      "BOLA": 8,
      "FLAGE": 6,
      "CONECTA": 6,
      "RVC": 2,
      "SALIM": 1
    },
    "totalCoupons": 308,
    "totalPayingQty": 664,
    "percentPaying": 64.0926640926641,
    "avgTicket": 85.50903614457832,
    "doorRevenue": 0,
    "doorQty": 0,
    "doorTM": 0,
    "dailySales": [],
    "preSaleRevenue": 56778,
    "preSaleQty": 1036,
    "avgAge": 22.1,
    "salesChannels": {
      "pos": 638,
      "site": 304,
      "app": 94
    }
  },
  {
    "id": "evt-auto-9",
    "name": "Sweet (16/01/2026)",
    "date": "2026-01-16",
    "totalRevenue": 38096,
    "totalAudience": 754,
    "cortesias": 287,
    "coupons": {
      "GIRLS": 24,
      "GODOY": 14,
      "ANABIA": 29,
      "CONECTA": 19,
      "FESTASZS": 30,
      "BOLA": 11,
      "PARKERS": 58,
      "BRAGA": 2,
      "AGNOVA": 32,
      "VODKA": 3,
      "BALADA": 1,
      "SALIM": 3,
      "LAGOA": 1,
      "FLAGE": 2,
      "BR": 3
    },
    "totalCoupons": 232,
    "totalPayingQty": 467,
    "percentPaying": 61.936339522546426,
    "avgTicket": 81.57601713062098,
    "doorRevenue": 0,
    "doorQty": 0,
    "doorTM": 0,
    "dailySales": [],
    "preSaleRevenue": 38096,
    "preSaleQty": 754,
    "avgAge": 25.2,
    "salesChannels": {
      "pos": 481,
      "site": 225,
      "app": 48
    }
  },
  {
    "id": "evt-auto-10",
    "name": "Valeu Natalina (26/12/2025)",
    "date": "2025-12-26",
    "totalRevenue": 57441,
    "totalAudience": 1036,
    "cortesias": 360,
    "coupons": {
      "GODOY": 50,
      "AGNOVA": 15,
      "SALIM": 15,
      "GIRLS": 21,
      "PARKERS": 89,
      "FLAGE": 3,
      "BOLA": 5,
      "ANABIA": 5,
      "CONECTA": 33,
      "BRAGA": 10,
      "AGONIA": 2,
      "YASFRANCO": 6,
      "RIO": 2,
      "FESTASZS": 9,
      "RVC": 4,
      "VODKA": 3
    },
    "totalCoupons": 272,
    "totalPayingQty": 676,
    "percentPaying": 65.25096525096525,
    "avgTicket": 84.97189349112426,
    "doorRevenue": 0,
    "doorQty": 0,
    "doorTM": 0,
    "dailySales": [],
    "preSaleRevenue": 57441,
    "preSaleQty": 1036,
    "avgAge": 21.3,
    "salesChannels": {
      "pos": 637,
      "site": 279,
      "app": 120
    }
  }
];